source,raw_text,depth,depth_unit,height,height_unit,length,length_unit,width,width_unit,weight,weight_unit,power,power_unit,accuracy,line,field
offers_corpus_english_v2_random_100_clean.jsonl,tv h runterst tzung ohne andere zu st ren individuelle lautst rke regelung kabellose bertragung auswechselbare akkus mit diesem innovativen h rer verstehen sie musik oder tv sendungen besser ohne dabei ihre mitmenschen zu st ren toll dank individueller lautst rkenregelung stellen sie f r jedes ohr die passende lautst rke ein die tv h rhilfe sitzt dank kinnb gel leicht am ohr und bietet ihnen angenehmen tragekomfort darum ist sie auch f r brillentr ger geeignet ein echtes fliegengewicht mit seinen 55 gramm sp ren sie ihren neuen h rverst rker kaum kabellos dank infrarot bis zu 7 meter reichweite und ein extra lauter klang von bis zu 125 db berzeugen und wenn sie den h rer gerade mal nicht brauchen laden sie ihn einfach auf der dazugeh rigen ladestation tv h runterst tzung ideal f r h rgesch digte und ltere menschen lautst rke separat f r jedes ohr einstellbar kabellose ton bertragung per infrarot transmitter mono reichweite bis 7 meter extra laut mit 125 db endlich verstehen sie alles ohne andere zu st ren langlebige akkus 2x aaa auswechselbar bequemes aufladen ber die mitgelieferte ladestation ladezeit 4 6 stunden 3 5 mm stecker kabell nge 130 cm integriert z b f r ihren mp3 player ma e ladestation 150 x 82 x 45 mm h rer 155 x 194 x 25 mm nur 55 g leicht infrarot h rsystem inklusive dockingstation mit netzteil akkus und deutscher anleitung,,,,,,,,,55.0,g,,,0.5,12,description
offers_corpus_english_v2_random_100_clean.jsonl,product beschrijving dakine over under 49l automatische vertaling originele beschrijving is hier beschikbaar kenmerken uitbreidbaar compartimentsplit level design zorgt voor een gemakkelijke toegangbuitenkant organisator zakkenuitschuifbaar handvatvervangbare urethaan wielenspecificaties 3000 cu in 49l 23 x 14 x 13 5 59 x 36 x 35cm 7 75 3 5 kg uitgebreid 3900 cu in 64l 23 x 14 x 16 5 59 x 36 x 42cm materiaal 600d polyester600d polyester ripstop600d polyester heather bij bikeinn laten wij alle kenmerken zien van dakine over under 49l in onze winkel vindt u verschillende maten voor dakine over under 49l veilig betalen en gegarandeerde verzending ontdek bovendien meer dergelijke producten van dakine over under 49l en maak gebruik van onze andere aanbiedingen in uitrusting klik op de link om meer informatie te krijgen over specificaties klik op de link om meer informatie te krijgen over gebruiksaanwijzing maattabel,,,,,,,,,3.5,kg,,,0.5,19,description
offers_corpus_english_v2_random_100_clean.jsonl,"{'weight': '285 00 pound s', 'dimensions': '36 00 h x 72 00 w x 32 00 d', 'top width side side': '72 overall', 'table type': 'island', 'base type': 'open with undershelf', 'top construction': 'wood', 'base construction': 'wood'}",32.0,,36.0,,,,72.0,,,,,,0.5,34,key_value_pairs
offers_corpus_english_v2_random_100_clean.jsonl,tuscan island 72 l x 32 w x 36 h 1 3 4 thick hard rock maple edge grain top with varnique finish 2 utensil drawers slatted undershelf painted base with sand through finish large rope legs,,,36.0,,72.0,,32.0,,,,,,0.25,34,description
offers_corpus_english_v2_random_100_clean.jsonl,specs and details weight 285 00 pound s dimensions 36 00 h x 72 00 w x 32 00 d top width side side 72 overall table type island base type open with undershelf top construction wood base construction wood,32.0,,36.0,,,,72.0,,,,,,0.375,34,spec_table_content
offers_corpus_english_v2_random_100_clean.jsonl,trinkhorn methorn aus echtem horn ca 0 75 liter schon lange vor der zeit wikinger oder des mittelalters war das eines verbreitetsten trinkgef e hieraus wurde bei z nftigen gelagen nicht nur bekannte honigwein met genossen unsere trinkh rner meth dieser gr variieren und k nnen 700ml bis 899ml fassen die h sind von au en poliert was ihnen eine sehr glatte oberfl che verschafft innen sie lebensmittelecht lackiert bitte beachtet es gibt immer einzelst cke da sich um naturprodukte handelt farbw nsche nnt ihr in dem bermerkungsfeld bestellung hinterlegen diese werden so weit wie m glich ber cksichtigt auch tats chliche f llmenge kann vom nennvolumen abweichen llvolumen literversandgewicht 60 kg,,,,,,,,,60.0,kg,,,0.5,44,description
offers_corpus_english_v2_random_100_clean.jsonl,girl s plus sizes 0 6 equivalent sizes bust waist low hip 0 12 l 40 42 34 36 44 46 1 14 1x 42 44 36 38 46 48 16 2 18 2x 46 48 40 42 50 52 20 3 22 3x 50 54 44 48 54 58 24 4 24 4x 54 58 48 52 58 62 26 5 26 5x 58 62 52 56 64 68 28 6 30 6x 64 68 guy s tops us uk eu chest xs 34 36 87 91 34 36 sm 36 38 91 97 36 38 md 38 40 97 102 38 40 l 40 42 102 107 40 42 xl 44 107 114 42 45 xxl 46 114 122 45 48 3xl 50 122 130 48 51 4xl 52 130 137 51 54 guy s bottoms us international waist hip xs 71 76 28 30 34 36 sm 76 81 30 32 36 38 md 81 86 32 34 38 40 l 86 91 34 36 40 42 xl 91 97 36 39 42 45 2xl 97 101 39 41 45 48 3xl 101 107 41 44 48 51 4xl 107 112 44 47 51 54 shoes girls us euro uk inches centimeters 4 35 2 8 1875 20 8 4 5 35 2 5 8 375 21 3 5 35 36 3 8 5 21 6 5 5 36 3 5 8 75 22 2 6 36 37 4 8 875 22 5 6 5 37 4 5 9 0625 23 7 37 38 5 9 25 23 5 7 5 38 5 5 9 375 23 8 8 38 39 6 9 5 24 1 8 5 39 6 5 9 6875 24 6 9 39 40 7 9 875 25 1 9 5 40 7 5 10 25 4 10 40 41 8 10 1875 25 9 10 5 41 8 5 10 3125 26 2 11 41 42 9 10 5 26 7 11 5 42 9 5 10 6875 27 1 12 42 43 10 10 875 27 6 shoes guys us euro uk inches centimeters 6 39 5 5 9 25 23 5 6 5 39 6 9 5 24 1 7 40 6 5 9 625 24 4 7 5 40 41 7 9 75 24 8 8 41 7 5 9 9375 25 4 8 5 41 42 8 10 125 25 7 9 42 8 5 10 25 26 9 5 42 43 9 10 4375 26 7 10 43 9 5 10 5625 27 10 5 43 44 10 10 75 27 3 11 44 10 5 10 9375 27 9 11 5 44 45 11 11 125 28 3 12 45 11 5 11 25 28 6 13 46 12 5 11 5625 29 4 girl s plus sizes 0 6 equivalent sizes bust waist low hip 0 12 l 40 42 34 36 44 46 1 14 1x 42 44 36 38 46 48 16 2 18 2x 46 48 40 42 50 52 20 3 22 3x 50 54 44 48 54 58 24 4 24 4x 54 58 48 52 58 62 26 5 26 5x 58 62 52 56 64 68 28 6 30 6x 64 68 guy s tops us uk eu chest xs 34 36 87 91 34 36 sm 36 38 91 97 36 38 md 38 40 97 102 38 40 l 40 42 102 107 40 42 xl 44 107 114 42 45 xxl 46 114 122 45 48 3xl 50 122 130 48 51 4xl 52 130 137 51 54 guy s bottoms us international waist hip xs 71 76 28 30 34 36 sm 76 81 30 32 36 38 md 81 86 32 34 38 40 l 86 91 34 36 40 42 xl 91 97 36 39 42 45 2xl 97 101 39 41 45 48 3xl 101 107 41 44 48 51 4xl 107 112 44 47 51 54 shoes girls us euro uk inches centimeters 4 35 2 8 1875 20 8 4 5 35 2 5 8 375 21 3 5 35 36 3 8 5 21 6 5 5 36 3 5 8 75 22 2 6 36 37 4 8 875 22 5 6 5 37 4 5 9 0625 23 7 37 38 5 9 25 23 5 7 5 38 5 5 9 375 23 8 8 38 39 6 9 5 24 1 8 5 39 6 5 9 6875 24 6 9 39 40 7 9 875 25 1 9 5 40 7 5 10 25 4 10 40 41 8 10 1875 25 9 10 5 41 8 5 10 3125 26 2 11 41 42 9 10 5 26 7 11 5 42 9 5 10 6875 27 1 12 42 43 10 10 875 27 6 shoes guys us euro uk inches centimeters 6 39 5 5 9 25 23 5 6 5 39 6 9 5 24 1 7 40 6 5 9 625 24 4 7 5 40 41 7 9 75 24 8 8 41 7 5 9 9375 25 4 8 5 41 42 8 10 125 25 7 9 42 8 5 10 25 26 9 5 42 43 9 10 4375 26 7 10 43 9 5 10 5625 27 10 5 43 44 10 10 75 27 3 11 44 10 5 10 9375 27 9 11 5 44 45 11 11 125 28 3 12 45 11 5 11 25 28 6 13 46 12 5 11 5625 29 4,,,,,38.4,,,,,,,,0.125,64,spec_table_content
offers_corpus_english_v2_random_100_clean.jsonl,schutzart ip20 umgebungstemperatur betrieb 25 c 55 c umgebungstemperatur lagerung transport 25 c 85 c zul ssige luftfeuchtigkeit betrieb 10 95 nach din en 61131 2 zul ssige luftfeuchtigkeit lagerung transport 10 95 nach din en 61131 2 luftdruck betrieb 70 kpa 106 kpa bis 3000 m nn luftdruck lagerung transport 70 kpa 106 kpa bis 3000 m nn schock 25g kriterium 1 nach iec 60068 2 27 vibration betrieb 5g schnittstelle interbus lokalbus master anschlussart inline datenrangierer bertragungsgeschwindigkeit 500 kbaud 2 mbaud umschaltbar schnittstelle parametrierung bedienung diagnose anschlussart rs 232 c 6 polige mini din buchse ps 2 ethernet 10 100 rj45 bertragungsgeschwindigkeit max 115 2 kbit s schnittstelle ethernet 10base t 100base tx anschlussart rj45 buchse bertragungsgeschwindigkeit 10 100 mbit s stromaufnahme typisch 210 ma stromaufnahme maximal 870 ma 370 ma logikversorgung 500 ma analog spannungsversorgung versorgungsspannung 24 v dc versorgungsspannungsbereich 19 2 v dc 30 v dc restwelligkeit 5 verlustleistung max 5 w anzahl der prozessdaten max 4096 bit interbus max 32768 bit interner modbus client anzahl der unterst tzten teilnehmer max 128 anzahl der anschlie baren lokalbus teilnehmer max 63 stromaufnahme ist zu beachten anzahl der teilnehmer mit parameterkanal max 24 anzahl unterst tzter abzweigklemmen mit fernbusstich max 3 benennung eingang digitale eing nge anzahl der eing nge 8 anschlussart inline potenzialverteiler beschreibung des eingangs en 61131 2 typ 1 npn pnp benennung ausgang digitale ausg nge anzahl der ausg nge 4 anschlusstechnik 2 3 4 leiter maximaler ausgangsstrom je kanal 500 ma ohne analogen eingang ja ohne analogen ausgang ja ohne puls richtungs ausgang ja ohne z hlereingang ja programmierwerkzeug pc worx pc worx express programmspeicher 512 kbyte 43 k anweisungen il datenspeicher 512 kbyte remanenter datenspeicher 48 kbyte nvram anzahl steuerungs tasks 8 echtzeituhr ja,,,,,,,5.0,,,,30.0,v,0.125,88,spec_table_content
